{
  "$schema": "https://json-schema.org/draft/2020-12/schema",
  "$id": "https://simai.example/schema/dag-benchmark-v2.schema.json",
  "title": "Preemptive DAG scheduling benchmark v2",
  "type": "object",
  "additionalProperties": false,
  "required": [
    "schema_version", "id", "scenario", "family", "category",
    "objective", "time_unit", "semantics", "resources", "tasks"
  ],
  "properties": {
    "schema_version": {"const": "2.0"},
    "id": {"type": "string", "minLength": 1},
    "scenario": {"enum": ["single_channel", "muti_channel"]},
    "family": {"enum": ["parallel_chain", "complex_chain"]},
    "category": {"enum": ["random", "adversarial", "real"]},
    "objective": {"const": "makespan"},
    "time_unit": {"type": "string", "minLength": 1},
    "semantics": {
      "type": "object",
      "additionalProperties": false,
      "required": [
        "preemption", "decision_epoch", "optional_idle", "compute_model",
        "resource_model", "preemption_cost", "minimum_quantum"
      ],
      "properties": {
        "preemption": {"const": "communication_resume"},
        "decision_epoch": {"const": "task_event"},
        "optional_idle": {"const": false},
        "compute_model": {"const": "unbounded_parallel"},
        "resource_model": {"const": "exclusive_fixed_set"},
        "preemption_cost": {"const": 0},
        "minimum_quantum": {"const": 0}
      }
    },
    "resources": {
      "type": "array",
      "items": {
        "type": "object",
        "additionalProperties": false,
        "required": ["id", "kind"],
        "properties": {
          "id": {"type": "string", "minLength": 1},
          "kind": {"type": "string", "minLength": 1},
          "metadata": {"type": "object"}
        }
      }
    },
    "tasks": {
      "type": "array",
      "minItems": 1,
      "items": {
        "type": "object",
        "additionalProperties": false,
        "required": ["id", "kind", "duration", "dependencies", "resources"],
        "properties": {
          "id": {"type": "string", "minLength": 1},
          "kind": {"enum": ["compute", "communication"]},
          "duration": {"type": "integer", "minimum": 0},
          "dependencies": {
            "type": "array", "uniqueItems": true,
            "items": {"type": "string", "minLength": 1}
          },
          "resources": {
            "type": "array", "uniqueItems": true,
            "items": {"type": "string", "minLength": 1}
          },
          "metadata": {"type": "object"}
        }
      }
    },
    "metadata": {"type": "object"}
  }
}
