{
  "category": "adversarial",
  "family": "complex_chain",
  "id": "pm_active_reservation_np",
  "metadata": {
    "description": "An active flow keeps its route reserved.",
    "generator": "muti_channel",
    "lifted_from": "active_reservation_np",
    "parameters": {},
    "preemptive_generator_seed": 260819,
    "seed": null
  },
  "objective": "makespan",
  "resources": [
    {
      "id": "resource:other",
      "kind": "exclusive",
      "metadata": {
        "source_repr": "'other'"
      }
    },
    {
      "id": "resource:shared",
      "kind": "exclusive",
      "metadata": {
        "source_repr": "'shared'"
      }
    }
  ],
  "scenario": "muti_channel",
  "schema_version": "2.0",
  "semantics": {
    "compute_model": "unbounded_parallel",
    "decision_epoch": "task_event",
    "minimum_quantum": 0,
    "optional_idle": false,
    "preemption": "communication_resume",
    "preemption_cost": 0,
    "resource_model": "exclusive_fixed_set"
  },
  "tasks": [
    {
      "dependencies": [],
      "duration": 4,
      "id": "a",
      "kind": "communication",
      "resources": [
        "resource:shared"
      ]
    },
    {
      "dependencies": [],
      "duration": 1,
      "id": "b",
      "kind": "communication",
      "resources": [
        "resource:other"
      ]
    },
    {
      "dependencies": [
        "b"
      ],
      "duration": 1,
      "id": "c",
      "kind": "communication",
      "resources": [
        "resource:shared"
      ]
    }
  ],
  "time_unit": "tick"
}
