{
  "category": "random",
  "family": "parallel_chain",
  "id": "pm_random_chain_6",
  "metadata": {
    "generator": "parallel_chain",
    "lifted_from": "random_chain_6",
    "preemptive_generator_seed": 260819,
    "seed": 260819
  },
  "objective": "makespan",
  "resources": [
    {
      "id": "channel:0",
      "kind": "channel"
    }
  ],
  "scenario": "single_channel",
  "schema_version": "2.0",
  "semantics": {
    "compute_model": "unbounded_parallel",
    "decision_epoch": "task_event",
    "minimum_quantum": 0,
    "optional_idle": false,
    "preemption": "communication_resume",
    "preemption_cost": 0,
    "resource_model": "exclusive_fixed_set"
  },
  "tasks": [
    {
      "dependencies": [],
      "duration": 0,
      "id": "chain0_release",
      "kind": "compute",
      "resources": []
    },
    {
      "dependencies": [
        "chain0_release"
      ],
      "duration": 1,
      "id": "chain0_flow0",
      "kind": "communication",
      "resources": [
        "channel:0"
      ]
    },
    {
      "dependencies": [
        "chain0_flow0"
      ],
      "duration": 4,
      "id": "chain0_compute0",
      "kind": "compute",
      "resources": []
    },
    {
      "dependencies": [
        "chain0_compute0"
      ],
      "duration": 3,
      "id": "chain0_flow1",
      "kind": "communication",
      "resources": [
        "channel:0"
      ]
    },
    {
      "dependencies": [
        "chain0_flow1"
      ],
      "duration": 2,
      "id": "chain0_compute1",
      "kind": "compute",
      "resources": []
    },
    {
      "dependencies": [],
      "duration": 0,
      "id": "chain1_release",
      "kind": "compute",
      "resources": []
    },
    {
      "dependencies": [
        "chain1_release"
      ],
      "duration": 4,
      "id": "chain1_flow0",
      "kind": "communication",
      "resources": [
        "channel:0"
      ]
    },
    {
      "dependencies": [
        "chain1_flow0"
      ],
      "duration": 4,
      "id": "chain1_compute0",
      "kind": "compute",
      "resources": []
    },
    {
      "dependencies": [
        "chain1_compute0"
      ],
      "duration": 4,
      "id": "chain1_flow1",
      "kind": "communication",
      "resources": [
        "channel:0"
      ]
    },
    {
      "dependencies": [
        "chain1_flow1"
      ],
      "duration": 2,
      "id": "chain1_compute1",
      "kind": "compute",
      "resources": []
    },
    {
      "dependencies": [
        "chain1_compute1"
      ],
      "duration": 2,
      "id": "chain1_flow2",
      "kind": "communication",
      "resources": [
        "channel:0"
      ]
    },
    {
      "dependencies": [
        "chain1_flow2"
      ],
      "duration": 2,
      "id": "chain1_compute2",
      "kind": "compute",
      "resources": []
    },
    {
      "dependencies": [],
      "duration": 0,
      "id": "chain2_release",
      "kind": "compute",
      "resources": []
    },
    {
      "dependencies": [
        "chain2_release"
      ],
      "duration": 2,
      "id": "chain2_flow0",
      "kind": "communication",
      "resources": [
        "channel:0"
      ]
    },
    {
      "dependencies": [
        "chain2_flow0"
      ],
      "duration": 3,
      "id": "chain2_compute0",
      "kind": "compute",
      "resources": []
    },
    {
      "dependencies": [
        "chain2_compute0"
      ],
      "duration": 3,
      "id": "chain2_flow1",
      "kind": "communication",
      "resources": [
        "channel:0"
      ]
    },
    {
      "dependencies": [
        "chain2_flow1"
      ],
      "duration": 4,
      "id": "chain2_compute1",
      "kind": "compute",
      "resources": []
    },
    {
      "dependencies": [],
      "duration": 0,
      "id": "chain3_release",
      "kind": "compute",
      "resources": []
    },
    {
      "dependencies": [
        "chain3_release"
      ],
      "duration": 2,
      "id": "chain3_flow0",
      "kind": "communication",
      "resources": [
        "channel:0"
      ]
    },
    {
      "dependencies": [
        "chain3_flow0"
      ],
      "duration": 5,
      "id": "chain3_compute0",
      "kind": "compute",
      "resources": []
    },
    {
      "dependencies": [
        "chain3_compute0"
      ],
      "duration": 3,
      "id": "chain3_flow1",
      "kind": "communication",
      "resources": [
        "channel:0"
      ]
    },
    {
      "dependencies": [
        "chain3_flow1"
      ],
      "duration": 1,
      "id": "chain3_compute1",
      "kind": "compute",
      "resources": []
    },
    {
      "dependencies": [],
      "duration": 0,
      "id": "chain4_release",
      "kind": "compute",
      "resources": []
    },
    {
      "dependencies": [
        "chain4_release"
      ],
      "duration": 4,
      "id": "chain4_flow0",
      "kind": "communication",
      "resources": [
        "channel:0"
      ]
    },
    {
      "dependencies": [
        "chain4_flow0"
      ],
      "duration": 2,
      "id": "chain4_compute0",
      "kind": "compute",
      "resources": []
    },
    {
      "dependencies": [
        "chain4_compute0"
      ],
      "duration": 2,
      "id": "chain4_flow1",
      "kind": "communication",
      "resources": [
        "channel:0"
      ]
    },
    {
      "dependencies": [
        "chain4_flow1"
      ],
      "duration": 6,
      "id": "chain4_compute1",
      "kind": "compute",
      "resources": []
    },
    {
      "dependencies": [
        "chain4_compute1"
      ],
      "duration": 2,
      "id": "chain4_flow2",
      "kind": "communication",
      "resources": [
        "channel:0"
      ]
    },
    {
      "dependencies": [
        "chain4_flow2"
      ],
      "duration": 3,
      "id": "chain4_compute2",
      "kind": "compute",
      "resources": []
    }
  ],
  "time_unit": "tick"
}
