{
  "category": "adversarial",
  "family": "complex_chain",
  "id": "pm_deferred_w_competition",
  "metadata": {
    "canonical_form": "raw_general_dag",
    "description": "Several W/DP side jobs compete with a PP flow that unlocks backbone compute.",
    "generator": "complex_chain",
    "lifted_from": "deferred_w_competition",
    "parameters": {},
    "preemptive_generator_seed": 260819,
    "seed": null,
    "semantic_scope": null,
    "stage2_group": "legacy"
  },
  "objective": "makespan",
  "resources": [
    {
      "id": "channel:0",
      "kind": "channel"
    }
  ],
  "scenario": "single_channel",
  "schema_version": "2.0",
  "semantics": {
    "compute_model": "unbounded_parallel",
    "decision_epoch": "task_event",
    "minimum_quantum": 0,
    "optional_idle": false,
    "preemption": "communication_resume",
    "preemption_cost": 0,
    "resource_model": "exclusive_fixed_set"
  },
  "tasks": [
    {
      "dependencies": [],
      "duration": 1,
      "id": "pp",
      "kind": "communication",
      "metadata": {
        "role": "pp"
      },
      "resources": [
        "channel:0"
      ]
    },
    {
      "dependencies": [
        "pp"
      ],
      "duration": 7,
      "id": "backbone",
      "kind": "compute",
      "metadata": {
        "role": "backbone"
      },
      "resources": []
    },
    {
      "dependencies": [],
      "duration": 1,
      "id": "w0",
      "kind": "compute",
      "metadata": {
        "role": "w"
      },
      "resources": []
    },
    {
      "dependencies": [
        "w0"
      ],
      "duration": 2,
      "id": "dp0",
      "kind": "communication",
      "metadata": {
        "role": "dp"
      },
      "resources": [
        "channel:0"
      ]
    },
    {
      "dependencies": [],
      "duration": 1,
      "id": "w1",
      "kind": "compute",
      "metadata": {
        "role": "w"
      },
      "resources": []
    },
    {
      "dependencies": [
        "w1"
      ],
      "duration": 3,
      "id": "dp1",
      "kind": "communication",
      "metadata": {
        "role": "dp"
      },
      "resources": [
        "channel:0"
      ]
    },
    {
      "dependencies": [],
      "duration": 1,
      "id": "w2",
      "kind": "compute",
      "metadata": {
        "role": "w"
      },
      "resources": []
    },
    {
      "dependencies": [
        "w2"
      ],
      "duration": 2,
      "id": "dp2",
      "kind": "communication",
      "metadata": {
        "role": "dp"
      },
      "resources": [
        "channel:0"
      ]
    },
    {
      "dependencies": [
        "backbone",
        "dp0",
        "dp1",
        "dp2"
      ],
      "duration": 1,
      "id": "optimizer",
      "kind": "compute",
      "metadata": {
        "role": "optimizer"
      },
      "resources": []
    }
  ],
  "time_unit": "tick"
}
