{
  "category": "adversarial",
  "family": "complex_chain",
  "id": "pm_stage3_depth2_investment",
  "metadata": {
    "description": "A first compatible set changes which resource pair matters at the next decision.",
    "generator": "stage3_structural_adversarial_cases",
    "parameters": {
      "attack_target": "finite_depth_compatible_set_rollout",
      "mechanism": "future_release_changes_set_complementarity",
      "semantic_scope": "fixed_resource_preemptive"
    },
    "semantic_scope": "fixed_resource_preemptive"
  },
  "objective": "makespan",
  "resources": [
    {
      "id": "resource:r0",
      "kind": "exclusive",
      "metadata": {
        "source_repr": "'r0'"
      }
    },
    {
      "id": "resource:r1",
      "kind": "exclusive",
      "metadata": {
        "source_repr": "'r1'"
      }
    }
  ],
  "scenario": "muti_channel",
  "schema_version": "2.0",
  "semantics": {
    "compute_model": "unbounded_parallel",
    "decision_epoch": "task_event",
    "minimum_quantum": 0,
    "optional_idle": false,
    "preemption": "communication_resume",
    "preemption_cost": 0,
    "resource_model": "exclusive_fixed_set"
  },
  "tasks": [
    {
      "dependencies": [],
      "duration": 1,
      "id": "release",
      "kind": "compute",
      "resources": []
    },
    {
      "dependencies": [],
      "duration": 3,
      "id": "a",
      "kind": "communication",
      "metadata": {
        "role": "attack_decision"
      },
      "resources": [
        "resource:r0",
        "resource:r1"
      ]
    },
    {
      "dependencies": [],
      "duration": 2,
      "id": "b",
      "kind": "communication",
      "metadata": {
        "role": "attack_decision"
      },
      "resources": [
        "resource:r0"
      ]
    },
    {
      "dependencies": [
        "release"
      ],
      "duration": 2,
      "id": "c",
      "kind": "communication",
      "metadata": {
        "role": "attack_decision"
      },
      "resources": [
        "resource:r1"
      ]
    },
    {
      "dependencies": [
        "a"
      ],
      "duration": 3,
      "id": "a_compute",
      "kind": "compute",
      "resources": []
    },
    {
      "dependencies": [
        "b"
      ],
      "duration": 4,
      "id": "b_compute",
      "kind": "compute",
      "resources": []
    },
    {
      "dependencies": [
        "c"
      ],
      "duration": 5,
      "id": "c_compute",
      "kind": "compute",
      "resources": []
    },
    {
      "dependencies": [
        "a_compute",
        "b_compute",
        "c_compute"
      ],
      "duration": 2,
      "id": "barrier",
      "kind": "compute",
      "metadata": {
        "role": "barrier"
      },
      "resources": []
    }
  ],
  "time_unit": "tick"
}
