{
  "category": "adversarial",
  "family": "complex_chain",
  "id": "pm_optimizer_dp_burst",
  "metadata": {
    "description": "A concentrated set of DP flows forms the optimizer barrier.",
    "generator": "complex_chain",
    "lifted_from": "optimizer_dp_burst",
    "parameters": {},
    "preemptive_generator_seed": 260819,
    "seed": null
  },
  "objective": "makespan",
  "resources": [
    {
      "id": "channel:0",
      "kind": "channel"
    }
  ],
  "scenario": "single_channel",
  "schema_version": "2.0",
  "semantics": {
    "compute_model": "unbounded_parallel",
    "decision_epoch": "task_event",
    "minimum_quantum": 0,
    "optional_idle": false,
    "preemption": "communication_resume",
    "preemption_cost": 0,
    "resource_model": "exclusive_fixed_set"
  },
  "tasks": [
    {
      "dependencies": [],
      "duration": 1,
      "id": "w0",
      "kind": "compute",
      "metadata": {
        "role": "w"
      },
      "resources": []
    },
    {
      "dependencies": [
        "w0"
      ],
      "duration": 2,
      "id": "dp0",
      "kind": "communication",
      "metadata": {
        "role": "dp"
      },
      "resources": [
        "channel:0"
      ]
    },
    {
      "dependencies": [],
      "duration": 2,
      "id": "w1",
      "kind": "compute",
      "metadata": {
        "role": "w"
      },
      "resources": []
    },
    {
      "dependencies": [
        "w1"
      ],
      "duration": 2,
      "id": "dp1",
      "kind": "communication",
      "metadata": {
        "role": "dp"
      },
      "resources": [
        "channel:0"
      ]
    },
    {
      "dependencies": [],
      "duration": 1,
      "id": "w2",
      "kind": "compute",
      "metadata": {
        "role": "w"
      },
      "resources": []
    },
    {
      "dependencies": [
        "w2"
      ],
      "duration": 2,
      "id": "dp2",
      "kind": "communication",
      "metadata": {
        "role": "dp"
      },
      "resources": [
        "channel:0"
      ]
    },
    {
      "dependencies": [],
      "duration": 2,
      "id": "w3",
      "kind": "compute",
      "metadata": {
        "role": "w"
      },
      "resources": []
    },
    {
      "dependencies": [
        "w3"
      ],
      "duration": 2,
      "id": "dp3",
      "kind": "communication",
      "metadata": {
        "role": "dp"
      },
      "resources": [
        "channel:0"
      ]
    },
    {
      "dependencies": [
        "dp0",
        "dp1",
        "dp2",
        "dp3"
      ],
      "duration": 2,
      "id": "optimizer",
      "kind": "compute",
      "metadata": {
        "role": "optimizer"
      },
      "resources": []
    }
  ],
  "time_unit": "tick"
}
