{
  "category": "adversarial",
  "family": "parallel_chain",
  "id": "pm_random_chain_60",
  "metadata": {
    "attack_target": "legacy_regression",
    "current_semantic_role": "legacy regression; not a current WAIT counterexample",
    "generator": "parallel_chain",
    "historical_origin": "v1/nonpreemptive lift",
    "lifted_from": "random_chain_60",
    "mechanism": "communication size competes with delayed downstream compute release",
    "preemptive_generator_seed": 260819,
    "seed": null,
    "stage1_group": "adversarial"
  },
  "objective": "makespan",
  "resources": [
    {
      "id": "channel:0",
      "kind": "channel"
    }
  ],
  "scenario": "single_channel",
  "schema_version": "2.0",
  "semantics": {
    "compute_model": "unbounded_parallel",
    "decision_epoch": "task_event",
    "minimum_quantum": 0,
    "optional_idle": false,
    "preemption": "communication_resume",
    "preemption_cost": 0,
    "resource_model": "exclusive_fixed_set"
  },
  "tasks": [
    {
      "dependencies": [],
      "duration": 0,
      "id": "chain0_release",
      "kind": "compute",
      "resources": []
    },
    {
      "dependencies": [
        "chain0_release"
      ],
      "duration": 4,
      "id": "chain0_flow0",
      "kind": "communication",
      "resources": [
        "channel:0"
      ]
    },
    {
      "dependencies": [
        "chain0_flow0"
      ],
      "duration": 2,
      "id": "chain0_compute0",
      "kind": "compute",
      "resources": []
    },
    {
      "dependencies": [
        "chain0_compute0"
      ],
      "duration": 4,
      "id": "chain0_flow1",
      "kind": "communication",
      "resources": [
        "channel:0"
      ]
    },
    {
      "dependencies": [
        "chain0_flow1"
      ],
      "duration": 5,
      "id": "chain0_compute1",
      "kind": "compute",
      "resources": []
    },
    {
      "dependencies": [],
      "duration": 0,
      "id": "chain1_release",
      "kind": "compute",
      "resources": []
    },
    {
      "dependencies": [
        "chain1_release"
      ],
      "duration": 1,
      "id": "chain1_flow0",
      "kind": "communication",
      "resources": [
        "channel:0"
      ]
    },
    {
      "dependencies": [
        "chain1_flow0"
      ],
      "duration": 5,
      "id": "chain1_compute0",
      "kind": "compute",
      "resources": []
    },
    {
      "dependencies": [],
      "duration": 0,
      "id": "chain2_release",
      "kind": "compute",
      "resources": []
    },
    {
      "dependencies": [
        "chain2_release"
      ],
      "duration": 2,
      "id": "chain2_flow0",
      "kind": "communication",
      "resources": [
        "channel:0"
      ]
    },
    {
      "dependencies": [
        "chain2_flow0"
      ],
      "duration": 2,
      "id": "chain2_compute0",
      "kind": "compute",
      "resources": []
    },
    {
      "dependencies": [],
      "duration": 0,
      "id": "chain3_release",
      "kind": "compute",
      "resources": []
    },
    {
      "dependencies": [
        "chain3_release"
      ],
      "duration": 2,
      "id": "chain3_flow0",
      "kind": "communication",
      "resources": [
        "channel:0"
      ]
    },
    {
      "dependencies": [
        "chain3_flow0"
      ],
      "duration": 1,
      "id": "chain3_compute0",
      "kind": "compute",
      "resources": []
    }
  ],
  "time_unit": "tick"
}
