{
  "category": "adversarial",
  "family": "complex_chain",
  "id": "preemption_unlock",
  "metadata": {
    "description": "A compute event releases a short communication with a long tail while a long communication is in progress."
  },
  "objective": "makespan",
  "resources": [
    {
      "id": "channel:0",
      "kind": "channel"
    }
  ],
  "scenario": "single_channel",
  "schema_version": "2.0",
  "semantics": {
    "compute_model": "unbounded_parallel",
    "decision_epoch": "task_event",
    "minimum_quantum": 0,
    "optional_idle": false,
    "preemption": "communication_resume",
    "preemption_cost": 0,
    "resource_model": "exclusive_fixed_set"
  },
  "tasks": [
    {
      "dependencies": [],
      "duration": 3,
      "id": "release_b",
      "kind": "compute",
      "resources": []
    },
    {
      "dependencies": [],
      "duration": 10,
      "id": "A",
      "kind": "communication",
      "resources": [
        "channel:0"
      ]
    },
    {
      "dependencies": [
        "release_b"
      ],
      "duration": 2,
      "id": "B",
      "kind": "communication",
      "resources": [
        "channel:0"
      ]
    },
    {
      "dependencies": [
        "B"
      ],
      "duration": 10,
      "id": "tail_b",
      "kind": "compute",
      "resources": []
    }
  ],
  "time_unit": "tick"
}
