{
  "category": "real",
  "family": "parallel_chain",
  "id": "pm_structured_symmetric",
  "metadata": {
    "generator": "parallel_chain",
    "lifted_from": "structured_symmetric",
    "preemptive_generator_seed": 260819,
    "projection_equivalence": "native Stage 1 instance; no dependencies removed",
    "provenance": "parameterized synthetic independent chains",
    "seed": null,
    "stage1_group": "structured"
  },
  "objective": "makespan",
  "resources": [
    {
      "id": "channel:0",
      "kind": "channel"
    }
  ],
  "scenario": "single_channel",
  "schema_version": "2.0",
  "semantics": {
    "compute_model": "unbounded_parallel",
    "decision_epoch": "task_event",
    "minimum_quantum": 0,
    "optional_idle": false,
    "preemption": "communication_resume",
    "preemption_cost": 0,
    "resource_model": "exclusive_fixed_set"
  },
  "tasks": [
    {
      "dependencies": [],
      "duration": 0,
      "id": "chain0_release",
      "kind": "compute",
      "resources": []
    },
    {
      "dependencies": [
        "chain0_release"
      ],
      "duration": 2,
      "id": "chain0_flow0",
      "kind": "communication",
      "resources": [
        "channel:0"
      ]
    },
    {
      "dependencies": [
        "chain0_flow0"
      ],
      "duration": 2,
      "id": "chain0_compute0",
      "kind": "compute",
      "resources": []
    },
    {
      "dependencies": [
        "chain0_compute0"
      ],
      "duration": 2,
      "id": "chain0_flow1",
      "kind": "communication",
      "resources": [
        "channel:0"
      ]
    },
    {
      "dependencies": [
        "chain0_flow1"
      ],
      "duration": 2,
      "id": "chain0_compute1",
      "kind": "compute",
      "resources": []
    },
    {
      "dependencies": [],
      "duration": 0,
      "id": "chain1_release",
      "kind": "compute",
      "resources": []
    },
    {
      "dependencies": [
        "chain1_release"
      ],
      "duration": 2,
      "id": "chain1_flow0",
      "kind": "communication",
      "resources": [
        "channel:0"
      ]
    },
    {
      "dependencies": [
        "chain1_flow0"
      ],
      "duration": 2,
      "id": "chain1_compute0",
      "kind": "compute",
      "resources": []
    },
    {
      "dependencies": [
        "chain1_compute0"
      ],
      "duration": 2,
      "id": "chain1_flow1",
      "kind": "communication",
      "resources": [
        "channel:0"
      ]
    },
    {
      "dependencies": [
        "chain1_flow1"
      ],
      "duration": 2,
      "id": "chain1_compute1",
      "kind": "compute",
      "resources": []
    },
    {
      "dependencies": [],
      "duration": 0,
      "id": "chain2_release",
      "kind": "compute",
      "resources": []
    },
    {
      "dependencies": [
        "chain2_release"
      ],
      "duration": 2,
      "id": "chain2_flow0",
      "kind": "communication",
      "resources": [
        "channel:0"
      ]
    },
    {
      "dependencies": [
        "chain2_flow0"
      ],
      "duration": 2,
      "id": "chain2_compute0",
      "kind": "compute",
      "resources": []
    },
    {
      "dependencies": [
        "chain2_compute0"
      ],
      "duration": 2,
      "id": "chain2_flow1",
      "kind": "communication",
      "resources": [
        "channel:0"
      ]
    },
    {
      "dependencies": [
        "chain2_flow1"
      ],
      "duration": 2,
      "id": "chain2_compute1",
      "kind": "compute",
      "resources": []
    }
  ],
  "time_unit": "tick"
}
