{
  "category": "random",
  "family": "complex_chain",
  "id": "pm_complex_random_000",
  "metadata": {
    "description": "Random small DAG with branch releases, second flows and a final join.",
    "generator": "complex_chain",
    "lifted_from": "complex_random_000",
    "parameters": {
      "branches": "3"
    },
    "preemptive_generator_seed": 260819,
    "seed": 260820
  },
  "objective": "makespan",
  "resources": [
    {
      "id": "channel:0",
      "kind": "channel"
    }
  ],
  "scenario": "single_channel",
  "schema_version": "2.0",
  "semantics": {
    "compute_model": "unbounded_parallel",
    "decision_epoch": "task_event",
    "minimum_quantum": 0,
    "optional_idle": false,
    "preemption": "communication_resume",
    "preemption_cost": 0,
    "resource_model": "exclusive_fixed_set"
  },
  "tasks": [
    {
      "dependencies": [],
      "duration": 3,
      "id": "r0",
      "kind": "compute",
      "metadata": {
        "role": "release"
      },
      "resources": []
    },
    {
      "dependencies": [
        "r0"
      ],
      "duration": 3,
      "id": "c0_0",
      "kind": "communication",
      "metadata": {
        "role": "tp"
      },
      "resources": [
        "channel:0"
      ]
    },
    {
      "dependencies": [
        "c0_0"
      ],
      "duration": 3,
      "id": "x0_0",
      "kind": "compute",
      "metadata": {
        "role": "backbone"
      },
      "resources": []
    },
    {
      "dependencies": [
        "x0_0"
      ],
      "duration": 2,
      "id": "c0_1",
      "kind": "communication",
      "metadata": {
        "role": "dp"
      },
      "resources": [
        "channel:0"
      ]
    },
    {
      "dependencies": [],
      "duration": 3,
      "id": "r1",
      "kind": "compute",
      "metadata": {
        "role": "release"
      },
      "resources": []
    },
    {
      "dependencies": [
        "r1"
      ],
      "duration": 3,
      "id": "c1_0",
      "kind": "communication",
      "metadata": {
        "role": "dp"
      },
      "resources": [
        "channel:0"
      ]
    },
    {
      "dependencies": [
        "c1_0"
      ],
      "duration": 4,
      "id": "x1_0",
      "kind": "compute",
      "metadata": {
        "role": "side"
      },
      "resources": []
    },
    {
      "dependencies": [],
      "duration": 2,
      "id": "r2",
      "kind": "compute",
      "metadata": {
        "role": "release"
      },
      "resources": []
    },
    {
      "dependencies": [
        "r2"
      ],
      "duration": 4,
      "id": "c2_0",
      "kind": "communication",
      "metadata": {
        "role": "dp"
      },
      "resources": [
        "channel:0"
      ]
    },
    {
      "dependencies": [
        "c2_0"
      ],
      "duration": 4,
      "id": "x2_0",
      "kind": "compute",
      "metadata": {
        "role": "side"
      },
      "resources": []
    },
    {
      "dependencies": [
        "x2_0"
      ],
      "duration": 4,
      "id": "c2_1",
      "kind": "communication",
      "metadata": {
        "role": "dp"
      },
      "resources": [
        "channel:0"
      ]
    },
    {
      "dependencies": [
        "c0_1",
        "x1_0",
        "c2_1"
      ],
      "duration": 1,
      "id": "optimizer_join",
      "kind": "compute",
      "metadata": {
        "role": "optimizer"
      },
      "resources": []
    }
  ],
  "time_unit": "tick"
}
