{
  "category": "adversarial",
  "family": "complex_chain",
  "id": "pm_stage3_join_hotspots",
  "metadata": {
    "description": "Two join inputs use different hotspots while an independent wide flow blocks both.",
    "generator": "stage3_structural_adversarial_cases",
    "parameters": {
      "attack_target": "join_branches_on_complementary_hotspots",
      "mechanism": "resource_complementarity_competes_with_single_tail",
      "semantic_scope": "fixed_resource_preemptive"
    },
    "semantic_scope": "fixed_resource_preemptive"
  },
  "objective": "makespan",
  "resources": [
    {
      "id": "resource:r0",
      "kind": "exclusive",
      "metadata": {
        "source_repr": "'r0'"
      }
    },
    {
      "id": "resource:r1",
      "kind": "exclusive",
      "metadata": {
        "source_repr": "'r1'"
      }
    }
  ],
  "scenario": "muti_channel",
  "schema_version": "2.0",
  "semantics": {
    "compute_model": "unbounded_parallel",
    "decision_epoch": "task_event",
    "minimum_quantum": 0,
    "optional_idle": false,
    "preemption": "communication_resume",
    "preemption_cost": 0,
    "resource_model": "exclusive_fixed_set"
  },
  "tasks": [
    {
      "dependencies": [],
      "duration": 2,
      "id": "left",
      "kind": "communication",
      "metadata": {
        "role": "join_input"
      },
      "resources": [
        "resource:r0"
      ]
    },
    {
      "dependencies": [],
      "duration": 2,
      "id": "right",
      "kind": "communication",
      "metadata": {
        "role": "join_input"
      },
      "resources": [
        "resource:r1"
      ]
    },
    {
      "dependencies": [],
      "duration": 3,
      "id": "wide",
      "kind": "communication",
      "metadata": {
        "role": "attack_decision"
      },
      "resources": [
        "resource:r0",
        "resource:r1"
      ]
    },
    {
      "dependencies": [
        "left",
        "right"
      ],
      "duration": 6,
      "id": "barrier",
      "kind": "compute",
      "metadata": {
        "role": "barrier"
      },
      "resources": []
    },
    {
      "dependencies": [
        "wide"
      ],
      "duration": 5,
      "id": "wide_tail",
      "kind": "compute",
      "resources": []
    },
    {
      "dependencies": [
        "barrier",
        "wide_tail"
      ],
      "duration": 1,
      "id": "sink",
      "kind": "compute",
      "resources": []
    }
  ],
  "time_unit": "tick"
}
