{
  "category": "adversarial",
  "family": "complex_chain",
  "id": "pm_large_flow_vs_long_tail",
  "metadata": {
    "canonical_form": "raw_general_dag",
    "description": "A short flow unlocks a long compute tail while a large flow competes.",
    "generator": "complex_chain",
    "lifted_from": "large_flow_vs_long_tail",
    "parameters": {
      "chains": "2"
    },
    "preemptive_generator_seed": 260819,
    "seed": null,
    "semantic_scope": null,
    "stage2_group": "legacy"
  },
  "objective": "makespan",
  "resources": [
    {
      "id": "channel:0",
      "kind": "channel"
    }
  ],
  "scenario": "single_channel",
  "schema_version": "2.0",
  "semantics": {
    "compute_model": "unbounded_parallel",
    "decision_epoch": "task_event",
    "minimum_quantum": 0,
    "optional_idle": false,
    "preemption": "communication_resume",
    "preemption_cost": 0,
    "resource_model": "exclusive_fixed_set"
  },
  "tasks": [
    {
      "dependencies": [],
      "duration": 1,
      "id": "c0_flow0",
      "kind": "communication",
      "metadata": {
        "role": "chain_flow"
      },
      "resources": [
        "channel:0"
      ]
    },
    {
      "dependencies": [
        "c0_flow0"
      ],
      "duration": 8,
      "id": "c0_compute0",
      "kind": "compute",
      "metadata": {
        "role": "chain_compute"
      },
      "resources": []
    },
    {
      "dependencies": [
        "c0_compute0"
      ],
      "duration": 1,
      "id": "c0_flow1",
      "kind": "communication",
      "metadata": {
        "role": "chain_flow"
      },
      "resources": [
        "channel:0"
      ]
    },
    {
      "dependencies": [
        "c0_flow1"
      ],
      "duration": 0,
      "id": "c0_compute1",
      "kind": "compute",
      "metadata": {
        "role": "chain_compute"
      },
      "resources": []
    },
    {
      "dependencies": [],
      "duration": 8,
      "id": "c1_flow0",
      "kind": "communication",
      "metadata": {
        "role": "chain_flow"
      },
      "resources": [
        "channel:0"
      ]
    },
    {
      "dependencies": [
        "c1_flow0"
      ],
      "duration": 0,
      "id": "c1_compute0",
      "kind": "compute",
      "metadata": {
        "role": "chain_compute"
      },
      "resources": []
    }
  ],
  "time_unit": "tick"
}
